item,itemLabel,party,partyLabel,area,areaLabel,startDate,endDate,gender,psid
Q5715430,Djombo Henri,Q1785816,Congolese Party of Labour,,,2002,,male,Q5715430-6DE5AE91-EAB2-408A-BE50-BC1AAEC14710
Q5493295,Ibovi François,Q1785816,Congolese Party of Labour,Q3124895,"Oyo, Republic of the Congo",1992,2012-09-05,male,Q5493295-6af382c9-445c-5cc7-5ab5-914c4f9c0501
Q112399,Kignoumbi Kia Mboungou,Q3550401,Pan-African Union for Social Democracy,,,2002,,male,Q112399-c2b8ce99-bb56-4659-8d39-df1bc7569b9e
Q3121597,Kolelas Guy- Parfait,Q3326534,Congolese Movement for Democracy and Integral Development,,,2007,2021-03-22,male,Q3121597-8661daa0-43df-1995-1133-86c6a78d3e75
Q7141729,Tsaty-Mabiala Pascal,Q3550401,Pan-African Union for Social Democracy,Q4267430,Loudima District,1992,,male,Q7141729-97222B80-78CD-42BF-ADB0-AA55161BFB59
